{
  "contract_id": "iagora.administrative-evidence",
  "contract_version": "1.0.0",
  "bundle_id": "administrative-evidence-respire-recre-2025",
  "bundle_version": "0.2.0",
  "observation_cutoff": "2025-12-31",
  "assembled_at": "2026-08-01T13:17:57+00:00",
  "territory": "fr-63113-clermont-ferrand",
  "raw_bytes_preserved": false,
  "documents": [
    {
      "artifact_version_id": "artifact-pev-2023-final-deliberation",
      "source_id": "src-city-education-project-2023",
      "title": "Final deliberation adopting the 2022–2025 municipal education project",
      "publisher": "Ville de Clermont-Ferrand",
      "canonical_url": "https://clermont-ferrand.fr/docs/delib/CM05052023/CM05052023_004.pdf",
      "issued_at": "2023-05-05",
      "document_role": "final_deliberation",
      "scope": {"level": "programme", "ids": ["programme-respire-a-la-recre"]},
      "acquisition": {"acquired_at": "2026-07-29T14:36:59+00:00", "media_type": "application/pdf", "byte_size": 69977, "sha256": "1f72cab17360abc856be80f17cfada0702c8f3b22eaf0f9012255422ab4266d7", "raw_bytes_preserved": false, "nonretention_reason": "third_party_rights_and_privacy_review_pending"},
      "rights": {"state": "rights_review_pending", "redistribution": "blocked", "notice_url": "https://clermont-ferrand.fr/mentions-legales-0", "review_state": "qualified_review_pending"},
      "authority": {"fact_type": "adopted_policy", "outcome": "authoritative", "basis": "The municipal council final deliberation records adoption of the attached 2022–2025 education project.", "limitations": ["Adoption of the policy does not by itself prove continuity from the campaign commitment, implementation, or impact."]},
      "evidence_fragments": [
        {"evidence_id": "evidence-pev-adoption-2023", "relationship": "supports", "locator": "page 2 of 3, decision paragraph", "statement": "The council adopted the 2022–2025 municipal education project unanimously.", "stage": "adopted_policy"},
        {"evidence_id": "evidence-pev-policy-history-2023", "relationship": "contextualizes", "locator": "page 2 of 3, opening paragraphs", "statement": "The deliberation states that the municipal education project began in 2015, continued with PEV 2 in 2018, and that the 2022–2025 version was built from the evaluation of PEV 2018–2022.", "stage": "adopted_policy"}
      ]
    },
    {
      "artifact_version_id": "artifact-pev-2023-adopted-annex",
      "source_id": "src-city-education-project-2023",
      "title": "Adopted 2022–2025 municipal education project annex",
      "publisher": "Ville de Clermont-Ferrand",
      "canonical_url": "https://clermont-ferrand.fr/docs/delib/CM05052023/CM05052023_004_annexe_0.pdf",
      "issued_at": "2023-05-05",
      "document_role": "adopted_annex",
      "scope": {"level": "programme", "ids": ["programme-respire-a-la-recre"]},
      "acquisition": {"acquired_at": "2026-07-29T14:37:00+00:00", "media_type": "application/pdf", "byte_size": 3639456, "sha256": "939b51ddc99be3408819dffdf974298d1c7b5012ea4333e8b3e62064cc70e24c", "raw_bytes_preserved": false, "nonretention_reason": "third_party_rights_and_privacy_review_pending"},
      "rights": {"state": "rights_review_pending", "redistribution": "blocked", "notice_url": "https://clermont-ferrand.fr/mentions-legales-0", "review_state": "qualified_review_pending"},
      "authority": {"fact_type": "adopted_policy", "outcome": "authoritative_with_limitation", "basis": "The annex adopted with the final deliberation defines the municipal Respire à la récré policy context.", "limitations": ["The annex is candidate mapping evidence because its objectives align with the campaign subject, but a reviewer must still validate the commitment-to-programme relationship."]},
      "evidence_fragments": [
        {"evidence_id": "evidence-pev-respire-definition-2023", "relationship": "contextualizes", "locator": "printed page 25, Respire à la récré inset", "statement": "The adopted policy identifies Respire à la récré as the transformation of schoolyards toward ecological, cooler, permeable, inclusive, and co-designed spaces.", "stage": "adopted_policy"}
      ]
    },
    {
      "artifact_version_id": "artifact-apcp-respire-2022-update",
      "source_id": "src-city-apcp-2022",
      "title": "29 June 2022 update of programme authorizations",
      "publisher": "Ville de Clermont-Ferrand",
      "canonical_url": "https://clermont-ferrand.fr/docs/delib/CM29062022/CM29062022_011.pdf",
      "issued_at": "2022-06-29",
      "document_role": "final_deliberation",
      "scope": {"level": "programme", "ids": ["programme-respire-a-la-recre"]},
      "acquisition": {"acquired_at": "2026-07-29T14:37:02+00:00", "media_type": "application/pdf", "byte_size": 110022, "sha256": "fdf8e63552d2fa93052214896ba7d158691f54245ccb0f1f5a1addf064d6e01c", "raw_bytes_preserved": false, "nonretention_reason": "third_party_rights_and_privacy_review_pending"},
      "rights": {"state": "rights_review_pending", "redistribution": "blocked", "notice_url": "https://clermont-ferrand.fr/mentions-legales-0", "review_state": "qualified_review_pending"},
      "authority": {"fact_type": "budget_amendment", "outcome": "authoritative", "basis": "The final council record unanimously validates the updated programme authorizations and payment-credit phasing.", "limitations": ["Programme authorization and payment-credit phasing do not establish a procurement obligation, school allocation, payment, or delivery."]},
      "evidence_fragments": [
        {"evidence_id": "evidence-apcp-respire-rephasing-2022", "relationship": "supports", "locator": "pages 3–4 of 6, item 4", "statement": "The decision rephased 350,000 euros of 2022 Respire payment credits to 2023 because works were delayed.", "stage": "budget_authorization", "amount": {"value": 350000, "currency": "EUR", "tax_basis": "not_stated", "financial_stage": "authorized_annual", "scope": "programme"}},
        {"evidence_id": "evidence-apcp-respire-total-2022", "relationship": "supports", "locator": "page 4 of 6, 2021-RESPIRE table", "statement": "The updated programme authorization total is 4,070,000 euros.", "stage": "budget_authorization", "amount": {"value": 4070000, "currency": "EUR", "tax_basis": "not_stated", "financial_stage": "authorized_programme", "scope": "programme"}}
      ]
    },
    {
      "artifact_version_id": "artifact-budget-2023-final-deliberation",
      "source_id": "src-city-budget-2023-adopted",
      "title": "Final deliberation adopting the 2023 initial budget",
      "publisher": "Ville de Clermont-Ferrand",
      "canonical_url": "https://clermont-ferrand.fr/docs/delib/CM14122022/CM14122022_008.pdf",
      "issued_at": "2022-12-14",
      "document_role": "final_deliberation",
      "scope": {"level": "programme", "ids": ["programme-respire-a-la-recre"]},
      "acquisition": {"acquired_at": "2026-07-29T14:51:25+00:00", "media_type": "application/pdf", "byte_size": 257063, "sha256": "61fc0eacc82c1bc7df2dd433946d05ff8a73f15b7ab701f7a696153d924d2de5", "raw_bytes_preserved": false, "nonretention_reason": "third_party_rights_and_privacy_review_pending"},
      "rights": {"state": "rights_review_pending", "redistribution": "blocked", "notice_url": "https://clermont-ferrand.fr/mentions-legales-0", "review_state": "qualified_review_pending"},
      "authority": {"fact_type": "initial_budget_authorization", "outcome": "authoritative", "basis": "The final deliberation records majority adoption of the 2023 initial budget and its annexes.", "limitations": ["The adopted budget authorizes forecasts; it is not a final account or proof of school-level expenditure."]},
      "evidence_fragments": [
        {"evidence_id": "evidence-budget-2023-respire-authorization", "relationship": "supports", "locator": "page 18 of 22, investment expenditure presentation", "statement": "The adopted 2023 budget presents 810,000 euros for schoolyard regreening and related uses.", "stage": "budget_authorization", "amount": {"value": 810000, "currency": "EUR", "tax_basis": "not_stated", "financial_stage": "authorized_annual", "scope": "programme"}}
      ]
    },
    {
      "artifact_version_id": "artifact-budget-2023-apcp-annex",
      "source_id": "src-city-budget-2023-adopted",
      "title": "2023 initial budget AP/CP annex",
      "publisher": "Ville de Clermont-Ferrand",
      "canonical_url": "https://clermont-ferrand.fr/docs/delib/CM14122022/CM14122022_008_A2.pdf",
      "issued_at": "2022-12-14",
      "document_role": "budget_annex",
      "scope": {"level": "programme", "ids": ["programme-respire-a-la-recre"]},
      "acquisition": {"acquired_at": "2026-07-29T14:37:01+00:00", "media_type": "application/pdf", "byte_size": 2964227, "sha256": "81d5f9e860c85fad872bdab37a1f5b0e562908087136e95df0eef9960f29ea01", "raw_bytes_preserved": false, "nonretention_reason": "third_party_rights_and_privacy_review_pending"},
      "rights": {"state": "rights_review_pending", "redistribution": "blocked", "notice_url": "https://clermont-ferrand.fr/mentions-legales-0", "review_state": "qualified_review_pending"},
      "authority": {"fact_type": "initial_budget_authorization", "outcome": "authoritative_with_limitation", "basis": "The annex adopted with the 2023 budget distinguishes total authorization, cumulative prior mandates, current credits, and later financing.", "limitations": ["The figures are programme aggregates and cannot be assigned to a selected school without a more granular accounting record."]},
      "evidence_fragments": [
        {"evidence_id": "evidence-budget-2023-ap-total", "relationship": "supports", "locator": "printed page 199, 2021-RESPIRE row", "statement": "The annex records a total Respire programme authorization of 4,070,000 euros.", "stage": "budget_authorization", "amount": {"value": 4070000, "currency": "EUR", "tax_basis": "not_stated", "financial_stage": "authorized_programme", "scope": "programme"}},